<?xml version="1.0" encoding="UTF-8"?><!DOCTYPE FunctionCatalog SYSTEM "fcat.dtd"><FunctionCatalog><CatalogVersion><Release>3.0.3.2</Release><Date>%CURRENT_DATE%</Date><Author>WG DA</Author><Company>MOST Cooperation</Company></CatalogVersion><Definition><ClassDef ClassID="class_trigger"><ClassDefName>Trigger</ClassDefName><ClassDefDesc/></ClassDef><ClassDef ClassID="class_switch"><ClassDefName>Switch</ClassDefName><ClassDefDesc/></ClassDef></Definition></FunctionCatalog>