<?xml version="1.0" encoding="UTF-8"?>
<!DOCTYPE FunctionCatalog SYSTEM "fcat.dtd">
<FunctionCatalog>
    <CatalogVersion>
        <Release>3.0.2.2</Release>
        <Date>%CURRENT_DATE%</Date>
        <Author>Specification Support</Author>
        <Company>MOST Cooperation</Company>
    </CatalogVersion>
    <FBlock>
        <FBlockID>0x0F</FBlockID>
        <FBlockKind>Proprietary</FBlockKind>
        <FBlockName>EnhancedTestability</FBlockName>
        <FBlockDescription>This is an FBlock description.</FBlockDescription>
        <FBlockVersion Access="public">
            <Release>3.0.2</Release>
            <Date>14-FEB-2011</Date>
            <Author>Specification Support</Author>
            <Company>MOST Cooperation</Company>
        </FBlockVersion>
    </FBlock>
    <FBlock>
        <FBlockID>0x10</FBlockID>
        <FBlockKind>Test</FBlockKind>
        <FBlockName>SecondFunctionBlock</FBlockName>
        <FBlockDescription>This is a second FBlock description.</FBlockDescription>
        <FBlockVersion Access="private">
            <Release>3.0.3</Release>
            <Date>18-MAR-2017</Date>
            <Author>Test User</Author>
            <Company>Software Verde</Company>
        </FBlockVersion>
    </FBlock>
    <Definition>
        <ClassDef ClassID="class_trigger">
            <ClassDefName>Trigger</ClassDefName>
            <ClassDefDesc/>
        </ClassDef>
        <ClassDef ClassID="class_switch">
            <ClassDefName>Switch</ClassDefName>
            <ClassDefDesc/>
        </ClassDef>
        <PCmdDef PCmdID="PCmdSet">
            <CmdDefName>Set</CmdDefName>
            <CmdDefDesc/>
            <CmdDefOPType>0x0</CmdDefOPType>
        </PCmdDef>
        <PCmdDef PCmdID="PCmdGet">
            <CmdDefName>Get</CmdDefName>
            <CmdDefDesc/>
            <CmdDefOPType>0x1</CmdDefOPType>
        </PCmdDef>
        <MCmdDef MCmdID="MCmdStart">
            <CmdDefName>Start</CmdDefName>
            <CmdDefDesc/>
            <CmdDefOPType>0x0</CmdDefOPType>
        </MCmdDef>
        <MCmdDef MCmdID="MCmdAbort">
            <CmdDefName>Abort</CmdDefName>
            <CmdDefDesc/>
            <CmdDefOPType>0x1</CmdDefOPType>
        </MCmdDef>
        <PReportDef PReportID="PReportStatus">
            <ReportDefName>Status</ReportDefName>
            <ReportDefDesc/>
            <ReportDefOPType>0xC</ReportDefOPType>
        </PReportDef>
        <PReportDef PReportID="PReportInterface">
            <ReportDefName>Interface</ReportDefName>
            <ReportDefDesc/>
            <ReportDefOPType>0xE</ReportDefOPType>
        </PReportDef>
        <MReportDef MReportID="MReportErrorAck">
            <ReportDefName>ErrorAck</ReportDefName>
            <ReportDefDesc/>
            <ReportDefOPType>0x9</ReportDefOPType>
        </MReportDef>
        <MReportDef MReportID="MReportProcessingAck">
            <ReportDefName>ProcessingAck</ReportDefName>
            <ReportDefDesc/>
            <ReportDefOPType>0xA</ReportDefOPType>
        </MReportDef>
        <TypeDef TypeID="type_record">
            <TDefName>Record</TDefName>
            <TDefDesc/>
            <TDefSize>255</TDefSize>
        </TypeDef>
        <TypeDef TypeID="type_array">
            <TDefName>Array</TDefName>
            <TDefDesc/>
            <TDefSize>255</TDefSize>
        </TypeDef>
    </Definition>
</FunctionCatalog>
